{
  "schema": "fdf/effective-rule-matrix.v1",
  "fdf_version": "1.2.1",
  "created_at": "2026-03-03T00:00:00Z",
  "selected_profiles": [],
  "profile_overrides": {},
  "enabled_packs": [],
  "rule_matrix": {
    "scope": [],
    "explore": [],
    "clarify": [],
    "architect": [],
    "implement": [],
    "verify": [],
    "summarize": []
  },
  "context_model": {},
  "notes": ""
}
